<?xml version="1.0" encoding="UTF-8"?>
<mappings version="2006-1" xmlns="http://www.tpb.se/ns/2006/wml2dtbook" xmlns:xsi="http://www.w3.org/2001/XMLSchema-instance" xsi:schemaLocation="http://www.tpb.se/ns/2006/wml2dtbook tagset.xsd">
	<custom style="default">
		<paragraphs>
			<tag name="example">
				<map value="p"/>
			</tag>
		</paragraphs>
		<character useInlineFormatting="true"/>
	</custom>
	<custom style="native">
		<paragraphs>
			<tag name="example">
				<map value="p"/>
			</tag>
		</paragraphs>
		<character useInlineFormatting="true"/>
	</custom>
	<custom style="scanned">
		<paragraphs>
			<tag name="example">
				<map value="p"/>
			</tag>
			<tag name="footnote text">
				<wrap value="note" addId="true" merge="false">
					<using value="p"/>
				</wrap>
			</tag>
		</paragraphs>
		<character useInlineFormatting="true">
			<tag name="footnote reference"><noteref/></tag>
		</character>
	</custom>
</mappings>